{
  "$schema": "http://json-schema.org/draft-07/schema#",
  "$id": "https://storyforge.local/schema/story-package-v1.schema.json",
  "title": "StoryForge Story Package v1",
  "type": "object",
  "additionalProperties": false,
  "required": ["schemaVersion", "id", "kind", "title", "summary", "blocks"],
  "properties": {
    "schemaVersion": { "const": "1.0" },
    "id": { "type": "string", "pattern": "^[a-z0-9][a-z0-9-]*$" },
    "kind": {
      "enum": ["person", "place", "event", "concept", "faction", "object", "species", "story", "collection", "other"]
    },
    "title": { "type": "string", "minLength": 1 },
    "summary": { "type": "string", "minLength": 1 },
    "theme": { "$ref": "#/definitions/partialTheme" },
    "media": {
      "type": "array",
      "items": { "$ref": "#/definitions/media" }
    },
    "blocks": {
      "type": "array",
      "minItems": 1,
      "items": { "$ref": "#/definitions/block" }
    },
    "relationships": {
      "type": "array",
      "items": { "$ref": "#/definitions/relationship" }
    },
    "entry": {
      "type": "object",
      "additionalProperties": false,
      "properties": {
        "priority": { "type": "number" },
        "featured": { "type": "boolean" },
        "hidden": { "type": "boolean" }
      }
    },
    "tags": {
      "type": "array",
      "items": { "type": "string" },
      "uniqueItems": true
    }
  },
  "definitions": {
    "palette": {
      "type": "object",
      "additionalProperties": false,
      "properties": {
        "background": { "type": "string" },
        "foreground": { "type": "string" },
        "surface": { "type": "string" },
        "muted": { "type": "string" },
        "accent": { "type": "string" }
      }
    },
    "partialTheme": {
      "type": "object",
      "additionalProperties": false,
      "properties": {
        "palette": { "$ref": "#/definitions/palette" },
        "typography": {
          "type": "object",
          "additionalProperties": false,
          "properties": {
            "tone": { "enum": ["editorial", "humanist", "modern", "technical"] }
          }
        },
        "motion": {
          "type": "object",
          "additionalProperties": false,
          "properties": {
            "pace": { "enum": ["still", "slow", "medium", "active"] }
          }
        },
        "composition": {
          "type": "object",
          "additionalProperties": false,
          "properties": {
            "density": { "enum": ["airy", "balanced", "dense"] },
            "mediaWeight": { "enum": ["low", "balanced", "dominant"] }
          }
        }
      }
    },
    "media": {
      "type": "object",
      "additionalProperties": false,
      "required": ["id", "type", "src"],
      "properties": {
        "id": { "type": "string", "minLength": 1 },
        "type": { "enum": ["image", "video", "audio", "model"] },
        "src": { "type": "string", "minLength": 1 },
        "alt": { "type": "string" },
        "caption": { "type": "string" },
        "role": {
          "enum": ["hero", "supporting", "portrait", "environment", "detail", "diagram"]
        },
        "focalPoint": {
          "type": "object",
          "additionalProperties": false,
          "required": ["x", "y"],
          "properties": {
            "x": { "type": "number", "minimum": 0, "maximum": 100 },
            "y": { "type": "number", "minimum": 0, "maximum": 100 }
          }
        }
      }
    },
    "relationship": {
      "type": "object",
      "additionalProperties": false,
      "required": ["id", "targetId", "label"],
      "properties": {
        "id": { "type": "string", "minLength": 1 },
        "targetId": { "type": "string", "minLength": 1 },
        "label": { "type": "string", "minLength": 1 },
        "summary": { "type": "string" },
        "weight": { "type": "number" }
      }
    },
    "timelineItem": {
      "type": "object",
      "additionalProperties": false,
      "required": ["id", "title"],
      "properties": {
        "id": { "type": "string" },
        "label": { "type": "string" },
        "title": { "type": "string" },
        "summary": { "type": "string" }
      }
    },
    "processItem": {
      "type": "object",
      "additionalProperties": false,
      "required": ["id", "title"],
      "properties": {
        "id": { "type": "string" },
        "title": { "type": "string" },
        "summary": { "type": "string" }
      }
    },
    "block": {
      "oneOf": [
        {
          "type": "object",
          "additionalProperties": false,
          "required": ["id", "type"],
          "properties": {
            "id": { "type": "string" },
            "type": { "const": "hero" },
            "title": { "type": "string" },
            "subtitle": { "type": "string" },
            "mediaId": { "type": "string" }
          }
        },
        {
          "type": "object",
          "additionalProperties": false,
          "required": ["id", "type", "paragraphs"],
          "properties": {
            "id": { "type": "string" },
            "type": { "const": "prose" },
            "heading": { "type": "string" },
            "paragraphs": { "type": "array", "minItems": 1, "items": { "type": "string" } }
          }
        },
        {
          "type": "object",
          "additionalProperties": false,
          "required": ["id", "type", "text"],
          "properties": {
            "id": { "type": "string" },
            "type": { "const": "quote" },
            "text": { "type": "string" },
            "attribution": { "type": "string" }
          }
        },
        {
          "type": "object",
          "additionalProperties": false,
          "required": ["id", "type", "mediaIds"],
          "properties": {
            "id": { "type": "string" },
            "type": { "const": "gallery" },
            "heading": { "type": "string" },
            "mediaIds": { "type": "array", "minItems": 1, "items": { "type": "string" } }
          }
        },
        {
          "type": "object",
          "additionalProperties": false,
          "required": ["id", "type", "items"],
          "properties": {
            "id": { "type": "string" },
            "type": { "const": "timeline" },
            "heading": { "type": "string" },
            "items": { "type": "array", "minItems": 1, "items": { "$ref": "#/definitions/timelineItem" } }
          }
        },
        {
          "type": "object",
          "additionalProperties": false,
          "required": ["id", "type", "items"],
          "properties": {
            "id": { "type": "string" },
            "type": { "const": "process" },
            "heading": { "type": "string" },
            "items": { "type": "array", "minItems": 1, "items": { "$ref": "#/definitions/processItem" } }
          }
        },
        {
          "type": "object",
          "additionalProperties": false,
          "required": ["id", "type"],
          "properties": {
            "id": { "type": "string" },
            "type": { "const": "relationships" },
            "heading": { "type": "string" }
          }
        }
      ]
    }
  }
}
